"","Tumors","cluster_lv","cluster_jw","cluster_cosine"
"1","b cell lymphoma","b cell lymphoma;b-cell lymphoma;t cell lymphoma;b cell lymphomas","b cell lymphoma;b-cell lymphoma;t cell lymphoma;b cell lymphomas;nk cell lymphoma;b cell lymphoma (bcl);t cell lymphomas","b cell lymphoma;b-cell lymphoma;t cell lymphoma;b cell lymphomas;lymphoma, b cell;b-cell small lymphocytic lymphoma"
"2","neuroblastoma","neuroblastoma;nephroblastoma;neuroblastomas","neuroblastoma;pineoblastoma;retinoblastoma;nephroblastoma;neuroblastoma. cns;neuroblastomas;neuroblastoma (nb)","neuroblastoma;retinoblastoma;olfactory neuroblastoma;nephroblastoma;neuroblastomas;regional neuroblastoma;extraocular retinoblastoma"
"3","triple negative breast cancer","triple-negative breast cancer;triple negative breast cancer;triple negative breast cancer tnbc;triple -negative breast cancer;node negative breast cancer","triple negative breast cancer;triple negative breast cancer (tnbc);triple negative breast cancer tnbc;triple -negative breast cancer;triple negative breast cancer, tnbc;triple negative breast carcinoma","triple-negative breast cancer;triple negative breast cancer;triple negative breast cancer tnbc;triple -negative breast cancer;breast cancer triple negative;triple negative breast cancer patients;early triple negative breast cancer"
"4","unresectable lung carcinoma","unresectable nut carcinoma;unresectable lung carcinoma;unresectable carcinoma","unresectable nut carcinoma;unresectable vaginal carcinoma;unresectable lung carcinoma;resectable carcinoma;unresectable carcinoma;unresectable lung carcinoid tumor;unresectable ewing sarcoma","unresectable acral lentiginous melanoma;unresectable nut carcinoma;unresectable renal cell carcinoma;unresectable laryngeal squamous cell carcinoma;unresectable vaginal carcinoma;unresectable lung carcinoma;unresectable carcinoma"
"5","liposarcoma","liposarcoma;fibrosarcoma;gliosarcoma;myosarcoma","liposarcoma;epithelioid sarcoma;gliosarcoma;liposarcoma, myxoid;myosarcoma;liposarcoma,myxoid","liposarcoma;gliosarcoma;pleomorphic liposarcoma;micropapillary serous carcinoma;macroprolactinoma;advanced liposarcoma or leiomyosarcoma;leiomyosarcoma or carcinosarcoma"
"6","cancer of the liver","cancer of the liver","cancer of the bladder;cancer of the ovary;cancer of the larynx;cancer of liver;cancer of the liver;cancer of the cervix;cancer of the kidney","cancer of the uterine cervix;cancer of liver;cancer of the liver;recurrent epithelial cancer of ovary;cancer of the cervix;stage iv cancer of the cervix;long-term adverse effects of radiotherapy for pelvic cancer"
"7","smoldering myeloma","multiple myeloma;multiple myelomas;smoldering myeloma;smoldering multiple myeloma;second-line melanoma;smouldering myeloma;multiple mieloma","relapsed hodgkin lymphoma;marginal lymphoma;smoldering myeloma;smoldering multiple myeloma;smoldering plasma cell myeloma;smoldering multiple myeloma (smm);smouldering myeloma","myeloid neoplasm;smoldering myeloma;smoldering multiple myeloma;smoldering plasma cell myeloma;smoldering multiple myeloma (smm);smoldering waldenstrom macroglobulinemia;smouldering myeloma"
